ReportId,RepCode,Name - Native,Name - English,Dir,PPA_Cutoff,Top_Cutoff,Type,Restrictions?,Region,SubRegionID,Country,NewCode,Keywords,Name_Native_Letter,Name_Native_Companies,Name_Native_Industry,Name_Native_Descriptive,Sect_Primary,Sect_Secondary,UK_Assoc1 to 20,PW_Assoc1 to 20,FR_Assoc1 to 20,IT_Assoc1 to 20,SP_Assoc1 to 20,NO_Assoc1 to 20,GE_Assoc1 to 20,RU_Assoc1 to 20,MultiCountry,Date_Last_Edited,Marketing_Description_Native,Marketing_Description_English,Report_Definition_Native,Report_Definition_English,Top3_1,Top3_2,Top3_3,Top20_1,Top20_2,Top20_3,Top20_4,Top20_5,Top20_6,Top20_7,Top20_8,Top20_9,Top20_10,Top20_11,Top20_12,Top20_13,Top20_14,Top20_15,Top20_16,Top20_17,Top20_18,Top20_19,Top20_20,AT_Assoc1 to 20
10478,PHAE,,Pharmaceutical Wholesalers,G:\PHARMWHE\,1000,,Normal,False,3,2,,PWHEADGM52B,paracetamol; bio-pharmaceuticals;biopharmaceuticals;biologicals;biologics;vaccines;bio-therapeutics;bio-therapeuticals;biotherapeutics;biotherapeuticals;pharmaceuticals;drugs;medicines;pills;healthcare;plasma;human;blood;generic;pharmaceutical; ,,Pharmaceutical Wholesalers,Pharmaceutical Wholesalers Industry,,Chem,Supp,,,,,,,,,,28/07/2017 12:39:58,,Companies involved in the wholesale distribution of pharmaceuticals and healthcare products,,healthcare distribution,,,,10477,10479,,,,,,,,,,,,,,,,,,,,
10479,PHA5,,Pharmaceuticals Manufacturers,G:\PHARM500\,1000,,Normal,False,3,1,,PWHEADGM51A,bio-pharmaceuticals;biopharmaceuticals;biologicals;biologics;vaccines;bio-therapeutics;bio-therapeuticals;biotherapeutics;biotherapeuticals;pharmaceuticals;drugs;medicines;pills;healthcare;plasma;human;blood;generic;pharmaceutical; ,,Pharmaceutical Manufacturing Companies,Pharmaceutical Manufacturing Industry,,Chem,Manu,,GENE;PHAW,,,,,,,,10/02/2016 00:00:00,,Companies involved in the manufacture of drugs or pharmaceuticals,,Pharmaceuticals are life-saving and life-enhancing medicines to improve the health of people; diagnose; cure; treat or prevent disease.,,,,10365,10477,915,10244,10221,16959,10270,11601,11635,10238,10268,4286,22244,,,,,,,,,
27627,PH60E,,Pharmacy Design & Fit Out,G:\PHARMFIT\,1000,0,Normal,True,3,2,,PWCONTCM77B,interior architect; interior design; commercial fit out; shopfitting; commercial furniture; retail furniture; pharmacy; pharmacies; chemist; chemists; shopfitters; retail fit out; retail design; point of sale; farmacie; farmacia; pharmacie,,Pharmacy Design & Fit Out Companies,Pharmacy Design & Fit Out Industry,,Buil,FuFi,,,,,,,,,,25/09/2023 00:00:00,,Companies providing commercial design and fit out services for pharmacies,,Companies specialised in interior design and fit out contractors with a specialism in the pharmacy sector.,,,,,,,,,,,,,,,,,,,,,,,,,
22235,PHOTE,,Photocopiers,G:\PHOTOCOP\,1000,0,Normal,False,3,2,,PWINFSUM28A,photocopiers;printers;copiers;photocopier;printer;fax;copier;scanners;colour;ricoh;copier;copier dealers;document;digital,,Photocopier Companies,Photocopier Industry,,Offi,Equi,,,,,,,,,,17/09/2018 00:00:00,,companies selling and dealing in photocopiers and document solutions,,A photocopier is an electronic machine that makes copies of images and documents. ... Now; enterprise-grade photocopiers are usually networked and perform multiple functions,,,,14611,,,,,,,,,,,,,,,,,,,,,
10480,PHOT,,Photographic Equipment Manufacturers,G:\PHOTEQUI\,1000,,Normal,False,3,1,,PWLEISEM42A,photo;photograph;photographic;optic;optical;lens;camera;cameras;digital;srl;tripod;film; ,,Photographic Equipment Manufacturers,Photographic Equipment Manufacturing Industry,,Info,Phot,,MAGN;OPTG,,,,,,,,13/03/2017 00:00:00,,Companies involved in the manufacture of photographic imaging and motion picture equipment,,photographic; video; gopro; camera; lens; filters; semiconductor sensors; digtal cameras; film camera; camera accessory; camcorder; digital imaging; analogue cameras;,,,,10422,10458,5324,,,,,,,,,,,,,,,,,,,
11604,PHOG,,Photonics,G:\PHOTONIC\,1100,,Normal,False,3,1,,PWELEETM39B,photonic;photonics;laser;optical;,,Photonic Companies,Photonic Industry,,Elec,Etrc,,,,,,,,,,02/08/2017 12:43:15,,Companies involved in the development; manufacture; distribution and wholesale of photonic; optical and laser technology products,,Photonics science includes the generation; emission; transmission; modulation; signal processing; switching;amplification; and detection/sensing of light.,,,,558,,,,,,,,,,,,,,,,,,,,,
4348,FO47W,,Pig Farming,G:\PIGFARMI\,1000,,Normal,False,3,1,,PWAGRAPM37A,pig;swine;hog;farm;piggery;farming;bacon;meat;,,Pig Farming Companies,Pig Farming Industry,,Agri,Farm,,FAPR;DAPO,,,,,,,,18/08/2015 00:00:00,,Companies involved in the raising of Pigs,,Pig farming is the raising and breeding of domestic pigs. It is a branch of animal husbandry. Pigs are raised principally as food (e.g. pork; bacon; gammon) and sometimes for their skin.,,,,10204,10305,3994,5327,,,,,,,,,,,,,,,,,,
22354,FOUN,,Piling & Foundation Contractors,G:\FOUNDATE\,1000,0,Normal,False,3,2,,PWCONTCM61A,,,Piling & Foundation Contractors,Piling & Foundation Contractors Industry,,Buil,Cont,,,,,,,,,,30/10/2018 12:47:08,,companies providing foundations; piling and underpinning services,,heavy stakes or posts installed to support the foundations of a superstructure A deep foundation is a type of foundation which transfers building loads to the earth farther down from the surface than a shallow foundation does; to a subsurface layer or a range of depths.A pile is a vertical structural element of a deep foundation; driven or drilled deep into the ground at the building site.,,,,,,,,,,,,,,,,,,,,,,,,,
10481,PLIG,,Pipeline Construction,G:\PIPELING\,1000,,Normal,True,3,1,,PWMETSEM26A,pipe;pipeline;construction;building;water;supply;flow;cement,,Pipeline Construction Companies,Pipeline Construction Industry,,Buil,Buil,,,,,,,,,,28/07/2017 11:26:13,,,,,,,,10295,10425,,,,,,,,,,,,,,,,,,,,
26675,PLBR,,Plant & Seed Breeding,G:\PLANBRPW\,1000,0,Normal,False,3,1,,PWAGRAPM66A,,,Plant & Seed Breeding Companies,Plant & Seed Breeding Industry,,Agri,Agri,,,,,,,,,,15/06/2022 17:03:11,,Companies breeding plants & seeds,,,,,,,,,,,,,,,,,,,,,,,,,,,
29571,PLRU,,Plastic & Rubber Manufacturers,G:\PLASRUB\,1200,0,Normal,False,3,1,,PWCHEPLM1A,,,Plastic & Rubber Manufacturing Industry,Plastic & Rubber Manufacturing Companies,,Chem,Mana,,,,,,,,,,15/01/2025 00:00:00,,,,Plastic and rubber manufacturers are companies that produce goods by processing plastic materials and raw rubber. This sector includes a wide range of products; from everyday items like plastic bags and rubber bands to more specialized products like automotive parts and industrial hoses.,,,,,,,,,,,,,,,,,,,,,,,,,
16855,PCAP,,Plastic Caps and Closures,G:\PLSTCAPS\,1000,,Normal,False,3,1,,PWPRIPPM44B,,,Plastic Caps and Closures Manufacturers,Plastic Caps and Closures Industry,,Plas,PrEq,,,,,,,,,,23/12/2016 00:00:00,,Companies involved in the design and manufacture of plastic seals; caps and closures,,dispensing solutions; crown cork; corks; pump dispensers; safety closures; lids; packaging locking solutions; packaging valves; snap hinge closures; trigger spray,,,,4882,,,,,,,,,,,,,,,,,,,,,
10482,PLAF,,Plastic Film & Sheet Manufacturers,G:\PLASFILM\,1000,,Normal,False,3,1,,PWCHEPLN51A,plastic;plastic;film;plastics;sheet;sheets,,Plastic Film & Sheet Manufacturers,Plastic Film & Sheet Manufacturing Industry,,Plas,Prod,,PPAG;IN86T,,,,,,,,22/12/2015 00:00:00,,Companies involved in plastic film and sheet extrusion,,film strip; plastic sheets; confectionery packaging; shrink wrap; cling film; laminated film; unlaminated film; blown film; shrink film; bubble film; stretch film; BOPP films; polyester films; breathable films;,,,,10483,4361,1281,105,6190,10052,5337,10051,,,,,,,,,,,,,,
19798,PLAFE,,Plastic Film & Sheet Manufacturers,G:\PLASFILE\,1000,0,Normal,False,3,2,,PWCHEPLM63A,film strip; plastic sheets; confectionery packaging; shrink wrap; cling film; laminated film; unlaminated film; blown film; shrink film; bubble film; stretch film; BOPP films; polyester films; breathable films;,,Plastic Film & Sheet Manufacturers,Plastic Film & Sheet Manufacturing Industry,,Plas,Pack,,,,,,,,,,02/01/2018 00:00:00,,Companies involved in plastic film and sheet extrusion,,,,,,5337,10051,5068,,,,,,,,,,,,,,,,,,,
14318,PLIN,,Plastic Injection Moulding,G:\PLSTINJG\,1000,,Normal,False,3,1,,PWCHESUM30A,,,Plastic Injection Moulding Manufacturers,Plastic Injection Moulding Industry,,Plas,Moul,,,,,,,,,,18/11/2015 00:00:00,,Companies involved in plastic injection moulding,,Plastic injection moulding (a division of Plastic Processing) is a manufacturing process for producing parts by injecting plastic into a mould.,10421,10396,,4429,4282,10260,10285,10231,5265,9595,,,,,,,,,,,,,,,
14319,PLIJ,,Plastic Injection Moulding,G:\PLSTINJE\,1000,,Normal,False,3,2,,PWCHESUM30C,,,Plastic Injection Moulding Manufacturers,Plastic Injection Moulding Industry,,Plas,Moul,,,,,,,,,,18/11/2015 00:00:00,,Companies involved in plastic injection moulding,,Plastic injection moulding (a division of Plastic Processing) is a manufacturing process for producing parts by injecting plastic into a mould.,,,,9595,,,,,,,,,,,,,,,,,,,,,
10483,PPAG,,Plastic Packaging Equipment,G:\PLASPAKG\,1000,,Normal,True,3,1,,PWPRIPPM32C,plastics;pipes;PEX;Piping;construction;polyethelene;packaging;equipment; ,,Plastic Packaging Equipment Manufacturers,Plastic Packaging Equipment Manufacturing Industry,,Plas,Pack,,PLAF;PPAE,,,,,,,,01/07/2011 00:00:00,,,,plastic packaging machinery,,,,10482,10484,,,,,,,,,,,,,,,,,,,,
10484,PPAE,,Plastic Packaging Equipment,G:\PLASPAKE\,1000,,Normal,True,3,2,,PWPRIPPM32D,plastics;pipes;PEX;Piping;construction;polyethelene;packaging;equipment; ,,Plastic Packaging Equipment Manufacturers,Plastic Packaging Equipment Manufacturing Industry,,Plas,Pack,,PLAF;PPAG,,,,,,,,01/07/2011 00:00:00,,,,plastic packaging machinery,,,,10482,10483,,,,,,,,,,,,,,,,,,,,
14320,PLPK,,Plastic Packaging Manufacturers,G:\PLSTPCKG\,1000,,Normal,False,3,1,,PWCHEPLM9A,,,Plastic Packaging Manufacturers,Plastic Packaging Industry,,Plas,Pack,,,,,,,,,,02/11/2015 00:00:00,,Companies involved in plastic packaging manufacturing; plastic packaging extrusion and blow molding manufacturers,,Plastic packaging includes rigid plastic containers; pots; screw tops; bottles; drums; trays; boxes; cups; protection packaging; plastic bags; bubble plastic; plastic strapping. Blow molding is a manufacturing process where hollow plastic parts are formed (extrusion blow moulding; injection blow moulding; injection stretch blow moulding),,,,6190,10052,10051,5334,,,,,,,,,,,,,,,,,,
14321,PLPE,,Plastic Packaging Manufacturers,G:\PLSTPCKE\,1000,,Normal,False,3,2,,PWPRIPPM20B,,,Plastic Packaging Manufacturers,Plastic Packaging Industry,,Plas,Pack,,,,,,,,,,03/11/2015 00:00:00,,Companies involved in plastic packaging manufacturing; plastic packaging extrusion and blow molding manufacturers,,Plastic packaging includes rigid plastic containers; pots; screw tops; bottles; drums; trays; boxes; cups; protection packaging; plastic bags; bubble plastic; plastic strapping. Blow molding is a manufacturing process where hollow plastic parts are formed (extrusion blow moulding; injection blow moulding; injection stretch blow moulding),,,,6188,6190,13676,,,,,,,,,,,,,,,,,,,
10485,PLP1,,Plastic Pipes,G:\PLAST100\,1000,,Normal,False,3,1,,PWMETSEM27A,plastics;pipes;PEX;Piping;construction;polyethelene,,Plastic Pipe Manufacturers,Plastic Pipe Manufacturing Industry,,Plas,Prod,,PPAG;SPAT,,,,,,,,17/08/2016 00:00:00,,Companies involved in the design and manufacture of plastic pipe; tube and fittings,,,,,,10483,10534,1127,14322,9606,,,,,,,,,,,,,,,,,
14322,PIPEU,,Plastic Pipes,G:\PLASPIPE\,1000,,Normal,False,3,2,,PWMETSEM27B,plastics;pipes;PEX;Piping;construction;polyethelene; plastic pipe;,,Plastic Pipe Manufacturers,Plastic Pipe Manufacturers,,Plas,Prod,,,,,,,,,,04/09/2017 00:00:00,,Companies involved in the design and manufacture of plastic pipe; tube and fittings,,,10485,,,10483,10534,1127,9606,14322,96,4159,5340,5341,13772,14323,,,,,,,,,,,
23718,PW45,,Plastic Product Manufacturers,G:\PW45PW45\,1000,0,Normal,True,3,1,,PWCHEPLM48A,,,,,,Chem,Prod,,,,,,,,,,24/02/2020 00:00:00,,companies manufacturing and supplying all types of plastic products,,Plastic is a material consisting of any of a wide range of synthetic or semi-synthetic organic compounds that are malleable and can be molded into solid objects. Plastics are typically organic polymers of high molecular mass; but they often contain other substances.,,,,,,,,,,,,,,,,,,,,,,,,,
23790,PW45E,,Plastic Product Manufacturers,G:\PW45E\,1000,0,Normal,True,3,2,,PWCHEPLM65A,,,,,,Chem,Prod,,,,,,,,,,03/03/2020 00:00:00,,,,Plastic product manufacturing involves transforming raw plastic materials; such as polymers and resins; into finished products through processes like injection molding; extrusion; and thermoforming. This industry designs; molds; shapes; and assembles plastic components; ensuring they meet quality and performance standards. Includes finished products.,,,,,,,,,,,,,,,,,,,,,,,,,
14323,PRCY,,Plastic Recycling,G:\PLSTRCYL\,1000,,Normal,False,3,1,,PWCHESUN64A,,,Plastic Recycling Companies,Plastic Recycling Industry,,Plas,Recy,,,,,,,,,,14/08/2017 00:00:00,,companies involved in plastic recycling and recovery,,waste plastic collection; recycling and distribution of plastic regrind; collection and recovery system for packaging; industrial packaging waste recycling; plastic recycling; plastic waste recycling,,,,96,5335,14141,9608,13772,6286,5374,5335,14588,,,,,,,,,,,,,
14324,PLVM,,Plastic Vacuum Forming,G:\PLSTVACM\,1000,,Normal,False,3,1,,PWCHEPLM60A,thermoform; thermoforming; vaccum; plastic;,,Plastic Vacuum Forming Manufacturers,Plastic Vacuum Forming Industry,,Plas,Moul,,,,,,,,,,10/11/2015 00:00:00,,Companies involved in plastic vacuum manufacturing,,Vacuum forming is a simplified version of thermoforming; whereby a sheet of plastic is heated to a forming temperature; stretched onto a single-surface mold; and forced against the mold by a vacuum (suction of air).,89,1614,19729,14320,10482,14871,10051,14663,18095,13720,19729,10052,5265,,,,,,,,,,,,
23576,PLVME,PLASTIC VACUUM THERMOFORMING PRODUCTS,Plastic Vacuum Thermoforming Products,G:\PLSTVACE\,1000,0,Normal,False,3,2,,PWCHEPLM64A,,Plastic Vacuum Thermoforming Products,Plastic Vacuum Thermoforming Companies,Plastic Vacuum Thermoforming Industry,,Plas,Moul,,,,,,,,,,02/01/2020 00:00:00,,Companies involved in plastic vacuum manufacturing,,Vacuum forming is a simplified version of thermoforming; whereby a sheet of plastic is heated to a forming temperature; stretched onto a single-surface mold; and forced against the mold by a vacuum (suction of air).,,,,,,,,,,,,,,,,,,,,,,,,,
22367,PLAY,,Playground Equipment,G:\PLAYGROU\,1000,0,Normal,False,3,2,,PWLEIEQM43A,,,,,,Leis,Equi,,,,,,,,,,06/11/2018 00:00:00,,companies involved in the design; manufacture and installation of outdoor playground equipment,,Companies providing playgrounds as well as indoor and outdoor play equipment. Mainly focuses on playground contractors supplying sets of play equipment for use in common and public areas.,,,,5503,,,,,,,,,,,,,,,,,,,,,
10486,PLUM,,Plumbing & Sanitary Ware,G:\PLUMFIXT\,1000,,Normal,False,3,1,,PWFURPDM64A,plumb;plumbing;fixtures;fittings;kitchen;fit;bathroom;cabinet;sink;sinks; sanitary ceramic; bathroom furniture; accessories; bathtub furniture;Sanitary ceramics; bathroom furniture; accessories; shower trays and baths;ceramic tiles; sanitary ware; bathroom furniture; bathtubs; frames and flush valves; sanitary; bathroom; showers; tiles,,Plumbing Fixtures & Fittings Manufacturers,Plumbing Fixtures & Fittings Manufacturing Industry,,Furn,Plum,,,,,,,,,,09/03/2017 00:00:00,,companies involved in the production and distribution of bathroom fixtures and fittings and sanitary ware,,sanitary ceramic; bathroom furniture; accessories; bathtub furniture;Sanitary ceramics; bathroom furniture; accessories; shower trays and baths;ceramic tiles; sanitary ware; bathroom furniture; bathtubs; frames and flush valves; sanitary; bathroom; showers; tiles,,,,4216,4572,5343,5193,,,,,,,,,,,,,,,,,,
11222,POPDM,,Point of Purchase Display,G:\POPDMEUR\,1000,,Normal,False,3,2,,PWCONPSM136A,shop;fittings;furniture;POS;counter;display;window;advert,,Point Of Purchase Display Manufacturers,Point Of Purchase Display Manufacturers,,Furn,Furn,,FUFI;ID03W,,,,,,,,17/04/2015 00:00:00,,,,,,,,10385,4316,5427,,,,,,,,,,,,,,,,,,,
27630,POPDM2,,Point of Purchase Display Manufacturers,G:\POPDMEPW\,1000,0,Normal,False,3,1,,PWCONPSM145B,,,Point of Purchase Display Manufacturing Companies,Point of Purchase Display Manufacturers Industry,,Furn,Reta,,,,,,,,,,27/09/2023 00:00:00,,Companies supplying and installing POP displays,,POP display; retail displays,,,,,,,,,,,,,,,,,,,,,,,,,
24859,SOFT8,,Point of Sale Software,G:\POSSOFTE\,1000,0,Normal,False,3,2,,PWINFSOM50A,,,,,,Info,Soft,,,,,,,,,,28/06/2021 16:11:38,,Companies involved in software for tills in shops and restaurants,,,,,,,,,,,,,,,,,,,,,,,,,,,
14865,PRTH,,Port Handling,G:\PORTHAND\,1000,,Normal,False,3,1,,PWTRASAM30A,port;terminal;;marine;cargo;handling;;stevedoring,,Port Handling Companies,Port Handling Industry,,Tran,Sea,,,,,,,,,,27/07/2017 20:04:25,,Companies involved in marine cargo handling (Port operators),,Activities from the time cargo; for or from a vessel; arrives at shipside; dock; pier; terminal; staging area; or in-transit area until cargo loading or unloading operations are completed,,,,14827,1393,1331,14747,14917,5205,5004,,,,,,,,,,,,,,,
4402,CS21W,,Port Services,G:\SHPSGLOB\,1000,,Normal,False,3,1,,PWTRARRN21A,Port Operations; Port Management; Cargo Handling; Storage; Navigational Assistance,,Port Service Companies,Port Services Industry,,Tran,Serv,,,,,,,,,,28/07/2017 08:12:15,,Companies involved port and terminal services,,,,,,4112,4403,10099,13804,5004,,,,,,,,,,,,,,,,,
14747,PORT,,Ports & Harbours,G:\PORTHARB\,1000,,Normal,False,3,2,,PWTRASAM30C,,,Ports & Harbours,Ports & Harbours Industry,,Tran,Sea,,,,,,,,,,11/03/2016 00:00:00,,Companies involved in owning; managing and operating seaport and harbour terminals,,A port operator is a company that moves cargo through a port. They manage the movement of cargo containers between cargo ships; trucks and freight trains and optimizing the flow of goods through customs to minimize the amount of time a ship spends in port. The port operator also manages paperwork; leases; safety and port security.,,,,484,1393,1331,5004,,,,,,,,,,,,,,,,,,
14917,PRTW,,Ports & Harbours,G:\PORTSGLB\,1000,,Normal,False,3,1,,PWTRASAM30B,,,Ports & Harbours,Ports & Harbours Industry,,Tran,Sea,,,,,,,,,,11/03/2016 00:00:00,,Companies involved in owning; managing and operating seaport and harbour terminals (Terminal operators),,A port operator is a company that moves cargo through a port. They manage the movement of cargo containers between cargo ships; trucks and freight trains and optimizing the flow of goods through customs to minimize the amount of time a ship spends in port. The port operator also manages paperwork; leases; safety and port security.,,,,5004,,,,,,,,,,,,,,,,,,,,,
29491,CINE3,,Post Production,G:\PWCINE3\,500,0,Normal,True,3,1,,PWMEDBGM49A,Editing video and audio; adding visual effects; color correction; sound design; and finalizing the project for distribution.,,Post Production Companies,Post Production Industry,,Medi,Ente,,,,,,,,,,05/11/2024 00:00:00,,,,Motion picture & TV post-production companies complete projects after filming by editing footage; designing sound; adding visual effects; adjusting colour and lighting; and creating titles and graphics. They collaborate with directors and producers to ensure the final product matches the filmmakers’ vision.,,,,,,,,,,,,,,,,,,,,,,,,,
4355,LS06W,,Postal & Courier Services,G:\POSEGLOB\,1000,,Normal,False,3,1,,PWTRARRM18A,post;postal;mail;distribution;delivery;logistics,,Postal Service Companies,Postal Service Industry,,Tran,Serv,,AIRF;TRAN,,,,,,,,13/04/2016 00:00:00,,Companies involved in the distribution of mail and parcels (including express delivery),,Air transport communications; delivery solutions for mail and parcels; courier; express delivery; time sensitive shipments,10507,,,10215,10552,1347,13775,4979,,,,,,,,,,,,,,,,,
18139,POTS,,Potatoes,G:\POTATOES\,1000,,Normal,False,3,1,,PWFOORSN37A,potato; potatoes; chips; fries; peeling; grow; grower; farm; farming; harvest; harvesting;,,Potato Companies,Potato Industry,,Agri,Prod,,,,,,,,,,18/04/2017 00:00:00,,Companies involved in the processing and preserving of potatoes,,potato farming; potato processing; peeling; prepacking; potato harvesting;,,,,11178,5348,,,,,,,,,,,,,,,,,,,,
10488,PEUR,,Poultry Producers,G:\POULEURO\,1000,,Normal,True,3,2,,PWAGRAFM40B,meat;food;poultry;chicken;feed;livestock;domestic fowl;chickens;turkey;ducks;geese;fresh meat;poultry products;,,Poultry Producers,Poultry Producing Industry,,Food,Proc,,,,,,,,,,10/11/2016 00:00:00,,companies involved in the production and farming of poultry meat,,Poultry is domestic fowl; such as chickens; turkeys; ducks; and geese. includes fresh meat; poultry products;,,,,10305,9931,5022,,,,,,,,,,,,,,,,,,,
10489,PT100,,Poultry Producers,G:\POULT100\,1000,,Normal,True,3,1,,PWAGRAFM40A,meat;food;poultry;chicken;feed;livestock;domestic fowl;chickens;turkey;ducks;geese;fresh meat;poultry products;,,Poultry Producers,Poultry Producing Industry,,Food,Proc,,DAPO;PEUR,,,,,,,,24/08/2015 00:00:00,,companies involved in the production and farming of poultry meat,,Poultry is domestic fowl; such as chickens; turkeys; ducks; and geese. includes fresh meat; poultry products;,16778,10427,,10305,10488,14707,14706,711,10347,10220,10371,3992,3994,13742,5349,,,,,,,,,,
4359,ID09W,,Powder Metallurgy,G:\POWDMETA\,1000,,Normal,False,3,1,,PWMETSPM28B,powder;powdered;metal;metallurgy;ferrous;non-ferrous;copper;powder;bronze;powder;gas;atomized,,Powder Metallurgy Producers,Powder Metallurgy Industry,,Meta,Moul,,MEFG;META,,,,,,,,06/01/2016 00:00:00,,Companies involved in powder metallurgy,,Powder metallurgy includes Additive Manufacturing; Hard Materials and Diamond Tools; Hot Isostatic Pressing; New Materials and Applications; Powder Injection Moulding; PM Structural Parts,,,,10435,10439,,,,,,,,,,,,,,,,,,,,
4360,CS24W,,Powered Access,G:\POWEACCE\,1000,,Normal,False,3,1,,PWCONTCM27A,Powered;access;working;at;height;scissor;lifts;access;platforms;rental;heavy;machinery;construction;lifting;equipment,,Powered Access Companies,Powered Access Industry,,Engi,Buil,,ARCH;COMI,,,,,,,,29/10/2015 00:00:00,,Companies involved in powered access manufacture and rental services,,Powered access includes scissors; booms; telehandlers; elevating work platforms; aerial work platforms; mobile elevating work platforms; mast climbing work platforms; safety training; truck cranes; trailer cranes; construction lifts; furniture lifts; construction winches; industrial lifts; masonry and gripper equipment; passenger lifts; freight lifts,,,,10222,10296,19544,18183,10295,10319,10414,6130,16396,9360,,,,,,,,,,,,
14325,PPEWE,,PPE Wholesalers & Distributors,G:\PPEWHDIE\,1000,,Normal,False,3,2,,PWFURRSM21A,,,Personal Protective Equipment Wholesalers,Personal Protective Equipment Wholesale Industry,,Clot,Supp,,,,,,,,,,12/10/2015 00:00:00,,Companies involved in the wholesale distribution of personal protective equipment,,PPE is equipment that will protect the user against health or safety risks at work. It can include items such as safety helmets; gloves; eye protection; high-visibility clothing; safety footwear and safety harnesses. It also includes respiratory protective equipment (RPE),,,,,,,,,,,,,,,,,,,,,,,,,
29379,PPEWG,,PPE Wholesalers & Distributors,G:\PPEWHDIG\,1000,0,Normal,False,3,1,,PWCLOSPM63A,,,Personal Protective Equipment Wholesale Companies,Personal Protective Equipment Wholesale Industry,,Clot,Supp,,,,,,,,,,03/09/2024 08:54:39,,,,PPE is equipment that will protect the user against health or safety risks at work. It can include items such as safety helmets; gloves; eye protection; high-visibility clothing; safety footwear and safety harnesses. It also includes respiratory protective equipment (RPE),,,,,,,,,,,,,,,,,,,,,,,,,
11224,PRSSG,,PR Consultants,G:\PRCOMSSG\,1000,,Normal,False,3,1,,PWMEDCMM33A,marketing;marketing;agencies;advertising;consultants;outsourcing;design;market; ,,PR and Communications Agencies,PR and Communications Industry,,Info,Mark,,,,,,,,,,03/08/2017 20:54:41,,companies providing public and media relations and marketing communications solutions,,Public relations is the practice of managing the spread of information between an individual or an organisation and the public.,18395,10426,,10201,10202,1091,10287,10341,10552,11610,10295,14261,19732,5917,9862,9863,14788,13608,14609,14550,,,,,
26849,PRSEU,,PR Consultants,G:\PRSSEU\,1000,10,Normal,True,3,2,,PWMEDCMM57A,marketing;marketing;agencies;advertising;consultants;outsourcing;design;market; ,,PR and Communications Agencies,PR and Communications Industry,,Medi,Comm,,,,,,,,,,23/09/2022 10:28:21,,companies providing public and media relations and marketing communications solutions,,Public relations is the practice of managing the spread of information between an individual or an organisation and the public.,,,,,,,,,,,,,,,,,,,,,,,,,
22802,PENG1,,Precision Engineering,G:\PRECENGG\,1000,0,Normal,True,3,1,,PWENGSUM63A,precision engineering; machining; fabricating; turned parts; nanotechnology; nanoengineering,,Precision Engineers,Precision Engineering Industry,,Engi,Serv,,,,,,,,,,21/03/2019 11:22:41,,companies involved in precision engineering and nanoengineering,,the design and building of machines; tools; etc. that need to be very accurate and exact,,,,,,,,,,,,,,,,,,,,,,,,,
