ReportId,RepCode,Name - Native,Name - English,Dir,PPA_Cutoff,Top_Cutoff,Type,Restrictions?,Region,SubRegionID,Country,NewCode,Keywords,Name_Native_Letter,Name_Native_Companies,Name_Native_Industry,Name_Native_Descriptive,Sect_Primary,Sect_Secondary,UK_Assoc1 to 20,PW_Assoc1 to 20,FR_Assoc1 to 20,IT_Assoc1 to 20,SP_Assoc1 to 20,NO_Assoc1 to 20,GE_Assoc1 to 20,RU_Assoc1 to 20,MultiCountry,Date_Last_Edited,Marketing_Description_Native,Marketing_Description_English,Report_Definition_Native,Report_Definition_English,Top3_1,Top3_2,Top3_3,Top20_1,Top20_2,Top20_3,Top20_4,Top20_5,Top20_6,Top20_7,Top20_8,Top20_9,Top20_10,Top20_11,Top20_12,Top20_13,Top20_14,Top20_15,Top20_16,Top20_17,Top20_18,Top20_19,Top20_20,AT_Assoc1 to 20
24885,EVMS,,Event Management Software,G:\EVENSOFT\,1000,0,Normal,False,3,1,,PWHOSSTN14C,,,Event Management Software Companies,Event Management Software Industry,,Info,Soft,,,,,,,,,,09/07/2021 00:00:00,,The companies analysed in the report provide software solutions for the organisation and management of events.,,Companies developing software for the organisation and management of events; mainly virtual.,,,,,,,,,,,,,,,,,,,,,,,,,
24941,REC6,,Executive Search,G:\EXECRECE\,1000,0,Normal,False,3,2,,PWSERREM50A,,,Executive Search Agencies,Executive Search Industry,,Recr,Serv,,,,,,,,,,09/08/2021 15:35:23,,Companies specialising in headhunting recruitment for higher-level management and director roles,,,,,,,,,,,,,,,,,,,,,,,,,,,
4161,PR02W,,Exhibition Design & Construction,G:\EXHICONS\,1000,,Normal,False,3,2,,PWHOSSTM16A,,,Exhibition Design & Construction Companies,Exhibition Design & Construction Industry,,Medi,Hosp,,,,,,,,,,29/03/2016 00:00:00,,Companies involved in design and construction for exhibition displays,,An Exhibition Designer is a professional who creates fixtures and display stands for events such as large public exhibitions; conferences; trade shows and temporary displays for business; museums; libraries and galleries.,,,,4098,1421,1420,1414,1418,15008,4963,4964,16379,9433,9434,13649,16337,16338,4161,5048,5048,5481,,,,
29203,PR03W,,Exhibition Design & Construction,G:\EXHICON5\,1000,0,Normal,False,3,1,,PWHOSSTM66A,,,Exhibition Design & Construction Companies,Exhibition Design & Construction Industries,,Medi,Hosp,,,,,,,,,,30/05/2024 00:00:00,,Companies involved in design and construction for exhibition displays,,An Exhibition Designer is a professional who creates fixtures and display stands for events such as large public exhibitions; conferences; trade shows and temporary displays for business; museums; libraries and galleries.,,,,,,,,,,,,,,,,,,,,,,,,,
23786,EXHL,,Exhibition Logistics,G:\EXHIBLOG\,1000,0,Normal,False,3,1,,PWTRARRN35F,,,,,,Tran,Road,,,,,,,,,,28/02/2020 15:24:35,,Companies involved in providing transportation logistics and freight handling services for the exhibition and live events industry,,transportation for the entertainment; exhibition and live events industry,,,,,,,,,,,,,,,,,,,,,,,,,
10339,EXPL,,Explosive Material Manufacturers,G:\EXPLMANU\,1000,,Normal,False,3,1,,PWENGSUM32A,explosive;explosives;chemical;industrial;explosives;raw;materials,,Explosive Material Manufacturers,Explosive Material Manufacturing Industry,,Chem,Chem,,,,,,,,,,01/08/2017 20:53:43,,Companies involved in commercial and industrial explosive and energetic material manufacturing,,Includes explosives; pyrotechnics; fireworks; energetic products; explosive devices; gunpowder,,,,10268,10376,5050,19561,,,,,,,,,,,,,,,,,,
14914,EXPE,,Explosives,G:\EXPLOSIV\,1000,,Normal,False,3,2,,PWFURPDM29A,,,Explosives Companies,Explosives Industry,,Chem,Chem,,,,,,,,,,31/07/2017 15:21:47,,Companies involved in commercial and industrial explosive and energetic materials,,Explosives manufacture involves creating materials that rapidly react to produce gas and heat; causing explosions. This process includes preparing raw materials; mixing them; shaping and packaging the compound; and ensuring safety through quality control.,,,,13703,,,,,,,,,,,,,,,,,,,,,
24808,GLS7,,Façade Glazing & Cladding,G:\FACGLAZE\,1000,0,Normal,False,3,2,,PWCONPSM195A,,,Façade Glazing & Cladding companies,Façade Glazing & Cladding industry,,Buil,Glas,,,,,,,,,,11/06/2021 12:47:05,,Companies involved in manufacturing; supplying and installing façade glazing & cladding,,,,,,,,,,,,,,,,,,,,,,,,,,,
16358,FMAN,,Facilities Management,G:\FCLTYMAN\,1000,,Normal,False,3,2,,PWSERPTM23A,,,Facilities Management Companies,Facilities Management Industry,,Prop,Serv,,,,,,,,,,02/08/2016 00:00:00,,Companies involved in property; building and facilities services management,,service management; Total Facilities Provider; facility services; facility management software; professional cleaning services; cleaning and maintenance of buildings; integrated service solutions; catering; cleaning; building maintenance; environmental services; security and reception; building cleaning,,,,200,1571,4367,10251,1404,5771,14056,14282,16358,14734,1160,10563,10325,4395,10282,10295,5994,6038,5046,5625,,
20903,FAST,,Fastener Distributors,G:\FASTENER\,1000,0,Normal,False,3,2,,PWMETPDN14B,fastener; fixing; nut; bolt;,,Fastener Distributors,Fastener Distribution Industry,,Buil,Supp,,,,,,,,,,08/03/2018 00:00:00,,Companies involved in the distribution of fasteners and fixings,,,,,,,,,,,,,,,,,,,,,,,,,,,
10340,FERZ,,Fertilizer Manufacturers,G:\FERTGLOB\,1000,,Normal,False,3,1,,PWAGREPN4A,fertilizer;agriculture;crops;protection;vegetables;growing;farming;chemicals;horticulture;food; ,,Fertilizer Manufacturers,Fertilizer Manufacturing Industry,,Chem,Chem,,FAPR;AGCE,,,,,,,,09/09/2016 00:00:00,,Companies involved in manufacturing and blending (mixing) of chemical and organic fertilizers,,Fertilizers include nitrogen; phosphorus; potassium; sulphur; NPK; magnesium; crop nutrition; crop care; phosphate fertilizers; compound fertilizers; water-soluble fertilizer; mineral fertilizers; plant nutrients; ammonia,,,,10204,10205,9,5922,4867,4929,,,,,,,,,,,,,,,,
10341,FILM,,Film & Television Production,G:\FILMPROD\,1000,,Normal,True,3,1,,PWMEDBGM7A,film;films;production;cinema;movie;movies;cinematic;camera; ,,Film & Television Production Companies,Film & Television Production Industry,,Medi,Publ,,,,,,,,,,18/08/2017 14:17:40,,,,production companies; post production;,,,,4389,10543,604,1068,1095,1073,10121,1097,4833,4934,5517,5473,,,,,,,,,,
26238,FILT1,,Filtration,G:\FILTRAEU\,1000,0,Normal,False,3,2,,PWENGMAM104A,,,Filtration,Filtration,,Engi,Equi,,,,,,,,,,17/12/2021 09:49:26,,Companies manufacturing or supplying filters and filtration equipment,,Includes water; oil; gas; chemical; dust,,,,,,,,,,,,,,,,,,,,,,,,,
24639,FIN3,,Financial Technology,G:\FINTECEU\,1000,0,Normal,False,3,2,,PWINFSOM47A,,,Financial Technology Companies,Financial Technology Industry,,Info,Soft,,,,,,,,,,07/04/2021 15:12:14,,Companies in Europe involved in developing software for the financial services industry including online banking and electronic payment systems,,,,,,,,,,,,,,,,,,,,,,,,,,,
10342,FIAL,,Fire Detection and Protection Equipment,G:\FIREALAR\,1000,,Normal,False,3,1,,PWSERSYM24A,fire;alarm;equipment;manufacturers;industrial;safety;building;hazard;warning;alarms,,Fire Detection and Protection Equipment Manufacturers,Fire Detection and Protection Industry,,Secu,Secu,,,,,,,,,,02/08/2017 13:22:24,,companies involved in the manufacture of fire detection equipment,,fire fighting equipment? extinguishers?,4395,,,10361,10516,566,10825,5059,1452,10309,16358,11610,10295,10263,10332,22062,,,,,,,,,
19678,FIRE,,Fire Fighting Vehicles,G:\FIRETRCK\,1000,0,Normal,False,3,1,,PWAUTPDM118A,fire engines; fire trucks; fire platforms; fire protection,,Fire Fighting Vehicle Manufacturers,Fire Fighting Vehicles Industry,,Moto,Mana,,,,,,,,,,26/10/2017 00:00:00,,Companies involved in the design and manufacture of fire fighting vehicles and parts,,includes fire engines; fire trucks; fire platforms. excludes trucks,10556,,,267,19678,219,5059,5654,14765,22062,,,,,,,,,,,,,,,
24576,MED2,,First Aid Supplies,G:\FIRSTAID\,1000,0,Normal,False,3,1,,PWHEAEPM24A,,,,,,Heal,PrEq,,,,,,,,,,11/03/2021 17:05:29,,Companies involved in manufacturing and supplying first aid products; woundcare and non-active medical devices,,first aid; woundcare; non active medical devices; dressings; sterile solutions; bandages; face masks; single use/ disposable instruments; sterile and non sterile textile medical devices; cotton (dental rolls; cosmetic pads; cotton tip applicators and cotton balls); hygiene disinfection and incontinence (cellulose wadding; lemon glycerine swabs; mattress cover; cellulose swabs; pillow cover; etc.); drapes and gowns (absorbent pad; protection gown; laparoscopy pouch; instrument pouch; fluid collection pouch; abdomino-perineal drape; etc.); general care (tongue depressor; medical applicator; galipot; pin balls; surgical brush; cervical brush; ayre spattles; baby blanket; and surgical skin marker with ruler); elastic bandages (sport tape; foam band; clip fasteners; conforming cohesive elastic bandage; conforming bandages; etc.); tubular bandages (finger/toe tube; applicators; stockinette; tube gauze; jersey undercast clothes); sterilization materials (absorbent mat; control tape and wrap; steam penetration test; tray liners; gussetted bags; pouches and control strips); gauze dressings (balls; swabs; eye pads; gauze darts; etc.); protection material (polyethylene aprons; operating cap; laboratory gown; impermeable and dental bibs; cap; colonoscopy shorts; etc.); non-woven dressings (adhesive tape; bob-woven balls; abdominal swabs; charcoal and foam dressing; drainage and tracheotomy sponges; etc.); first aid (cabinets; dressing; rescue sheet; burn sheet; high protection blanket; reptile and insects sting kit; etc.); sets (pap test kit; vesical catheterization kit; absorpotion set; epidural set; hemodialysis set; dressing set; tricotomy kit; catheterization set; etc.); surgical procedure sets - anesthesia; arthroscopy; extremities; opthalmology; laparotomy; gynaecology; laparoscopy; caesarian; cataracts; angiography; podiatry; spinal anesthesia and ENT; and disposable plastic devices (pitcher; forceps; ring basin and trays).,,,,,,,,,,,,,,,,,,,,,,,,,
26668,FAID,,First Aid Supplies,G:\FIRSTAEU\,1000,0,Normal,True,3,2,,PWHEAEPM76A,,,First Aid Equipment Companies,First Aid Suppliers Industry,,Heal,Supp,,,,,,,,,,08/06/2022 16:45:08,,Companies involved in manufacturing and supplying first aid products; woundcare and non-active medical devices,,first aid; woundcare; non active medical devices; dressings; sterile solutions; bandages; face masks; single use/ disposable instruments; sterile and non sterile textile medical devices; cotton (dental rolls; cosmetic pads; cotton tip applicators and cotton balls); hygiene disinfection and incontinence (cellulose wadding; lemon glycerine swabs; mattress cover; cellulose swabs; pillow cover; etc.); drapes and gowns (absorbent pad; protection gown; laparoscopy pouch; instrument pouch; fluid collection pouch; abdomino-perineal drape; etc.); general care (tongue depressor; medical applicator; galipot; pin balls; surgical brush; cervical brush; ayre spattles; baby blanket; and surgical skin marker with ruler); elastic bandages (sport tape; foam band; clip fasteners; conforming cohesive elastic bandage; conforming bandages; etc.); tubular bandages (finger/toe tube; applicators; stockinette; tube gauze; jersey undercast clothes); sterilization materials (absorbent mat; control tape and wrap; steam penetration test; tray liners; gussetted bags; pouches and control strips); gauze dressings (balls; swabs; eye pads; gauze darts; etc.); protection material (polyethylene aprons; operating cap; laboratory gown; impermeable and dental bibs; cap; colonoscopy shorts; etc.); non-woven dressings (adhesive tape; bob-woven balls; abdominal swabs; charcoal and foam dressing; drainage and tracheotomy sponges; etc.); first aid (cabinets; dressing; rescue sheet; burn sheet; high protection blanket; reptile and insects sting kit; etc.); sets (pap test kit; vesical catheterization kit; absorpotion set; epidural set; hemodialysis set; dressing set; tricotomy kit; catheterization set; etc.); surgical procedure sets - anesthesia; arthroscopy; extremities; opthalmology; laparotomy; gynaecology; laparoscopy; caesarian; cataracts; angiography; podiatry; spinal anesthesia and ENT; and disposable plastic devices (pitcher; forceps; ring basin and trays).,,,,,,,,,,,,,,,,,,,,,,,,,
10343,FWHO,,Fish Wholesalers,G:\FISHWHOL\,1000,,Normal,False,3,2,,PWFOOFIN59B,fish;mongers;fishmonger;fish;fishing;seafood;crustaceans;molluscs;crustacean;mollusca;mollusc;shell;shellfish;shell;fish;seafoods;molluscs;salmon;trout;cod;haddock;crabs;ouster;frozen;fish;sea;fish;smoked; fish merchant; fresh fish wholesale; seafood wholesale;,,Fish Wholesalers Companies,Fish Wholesalers Industry,,Food,Supp,,,,,,,,,,11/08/2017 11:02:22,,companies involved in the wholesale distribution of fish and seafood,,fish merchant; fresh fish wholesale; seafood wholesale;,,,,10283,10515,5416,719,675,6059,6060,5424,5413,5417,4900,5063,,,,,,,,,,
10283,COFI,,Fishing,G:\COMFISHI\,1000,,Normal,True,3,1,,PWFOOFIM59A,fish;fishing;seafood;sea;bait;wholesale;fish;trading;fish;vessels;deep;sea;fisheries;marine;boat;ship; ,,Fishing Companies,Fishing Industry,,Food,Fish,,,,,,,,,,16/11/2017 00:00:00,,Companies involved in catching fish and seafood from wild fisheries,,,,,,10343,10515,675,10345,4184,10350,6059,6060,5424,5413,5417,,,,,,,,,,,
20907,FISH,,Fishing Equipment,G:\FISHTACK\,1000,0,Normal,False,3,1,,PWLEIRSM15A,fishing; hooks; lines; sinkers; floats; rods; reels; baits;lures; spears; nets; gaffs; traps; waders; tackle box,,Fishing Equipment Companies,Fishing Equipment Industry,,Mari,Equi,,,,,,,,,,08/02/2018 00:00:00,,Companies involved in the manufacture; wholesale and retail of fishing equipment,,Fishing tackle is the equipment used by fishermen when fishing. Almost any equipment or gear used for fishing can be called fishing tackle. Some examples are hooks; lines; sinkers; floats; rods; reels; baits;lures; spears; nets; gaffs; traps; waders and tackle boxes.,,,,5449,,,,,,,,,,,,,,,,,,,,,
16674,FLAT,,Flat Glass,G:\GLASSFLT\,1000,,Normal,False,3,1,,PWCONBCN26B,,,Flat Glass Companies,Flat Glass Industry,,Buil,Glas,,,,,,,,,,31/07/2017 15:09:46,,Companies involved in the production of flat glass,,,4198,,,14305,10574,10253,4225,10443,10366,,,,,,,,,,,,,,,,
25128,FLXH,,Flexible Hoses,G:\FLEXHOSE\,1000,0,Normal,False,3,2,,PWMETPDM18A,,,,,,Meta,Prod,,,,,,,,,,21/10/2021 08:23:43,,Companies involved in the design and manufacture of flexible plastic hoses,,hydraulic hose; fluid hose; pneumatic hose; thermoplastic hose; PVC hose; PTFE hose;,,,,,,,,,,,,,,,,,,,,,,,,,
23510,FIBC,,Flexible Intermediate Bulk Container (FIBC) Manufacturers,G:\FIBCMANE\,1000,0,Normal,False,3,1,,PWCLOPDM64A,,,Flexible Intermediate Bulk Container (FIBC) Manufacturers,Flexible Intermediate Bulk Container (FIBC) Industry,,Clot,Prod,,,,,,,,,,22/11/2019 00:00:00,,Companies involved in the manufacture of bulk bags (FIBC),,companies involved in the manufacture of bulk bags (FIBC),,,,,,,,,,,,,,,,,,,,,,,,,
4167,ID02W,,Flexible Packaging Converters,G:\FLPKCONV\,1000,,Normal,False,3,1,,PWPRIPPM33A,cardboard;card;board;plastic;paper;packaging;boxes;cartons;corrugated;packaging;fabric;paperboard;paper;bags;plastic;bags;wrapping;flexible;package;flexible;packaging; ,,Flexible Packaging Converters,Flexible Packaging Converters Industry,,Offi,Supp,,FLPK;PAEQ,,,,,,,,09/11/2016 00:00:00,,Companies involved in the design and manufacture of flexible packaging,,Flexible packaging is produced from paper; plastic; film; aluminum foil; or any combination of those materials; and includes bags; pouches; labels; liners; wraps; rollstock; and other flexible products.,16560,10302,,10344,10466,5302,11635,4170,14321,16855,10467,16854,16732,10260,10482,1279,696,5068,14069,9605,13729,4167,5082,,
10344,FLPK,,Flexible Packaging Manufacturers,G:\FLEXPACK\,1000,,Normal,True,3,2,,PWPRIPPM20A,cardboard;card;board;plastic;paper;packaging;boxes;cartons;corrugated;packaging;fabric;paperboard;paper;bags;plastic;bags;wrapping;flexible;package;flexible;packaging; ,,Flexible Packaging Manufacturers,Flexible Packaging Manufacturing Industry,,Offi,Supp,,ID02W;PAEQ,,,,,,,,18/08/2010 00:00:00,,,,,,,,4167,10466,1279,10436,14320,16560,14744,4470,6188,13676,5068,,,,,,,,,,,
24805,FOAM2,,Flexible Polyurethane Foam,G:\FPFFOAME\,1000,0,Normal,False,3,2,,PWCHEPLN26B,,,Flexible Polyurethane Foam companies,Flexible Polyurethane Foam Industry,,Plas,Mana,,,,,,,,,,10/06/2021 00:00:00,,Companies involved in the production of Flexible Polyurethane Foam (FPF),,,,,,,,,,,,,,,,,,,,,,,,,,,
29707,IE82,,Flooring Contractors & Retailers,G:\IEFLOORS\,200,0,Normal,True,3,2,72,PWFURRSM87A,,,Flooring Contractors & Retail Companies,Flooring Contractors & Retail Industry,,Furn,Floo,,,,,,,,,,26/03/2025 15:09:10,,,,,,,,,,,,,,,,,,,,,,,,,,,,,
22012,FLO1,,Florists,G:\FLORISTG\,2000,0,Normal,False,3,1,,PWAGRRTM20A,flowers;florist;florists;plants;fresh flowers;wholesale;flower delivery;wedding flowers;gardening;roses;funeral;floristry,,,,,Agri,Reta,,,,,,,,,,19/09/2019 00:00:00,,companies involved in the wholesale and retail of flowers and plants,,,,,,,,,,,,,,,,,,,,,,,,,,,
29759,STRC,,Flour & Grain Milling,G:\INGASTAR\,1000,0,Normal,True,3,2,,PWAGRAPM69A,,,Flour & Grain Milling Companies,Flour & Grain Milling Industry,,Agri,Prod,,,,,,,,,,13/05/2025 00:00:00,,,,,,,,,,,,,,,,,,,,,,,,,,,,,
20908,FOAM,,Foam,G:\FOAMFOAM\,1000,0,Normal,False,3,2,,PWCHEPLM26A,Foam; polyurethane foam; sponge; polyurethane fillings; flexible foam;,,Foam Producers,Foam Industry,,Plas,Prod,,,,,,,,,,08/05/2018 00:00:00,,Companies involved in the manufacture of foam and converting foam products,,Converting companies are companies that specialize in combining raw materials such as polyesters; adhesives; silicone; tapes; foams; plastics; felts; rubbers; liners and metals; as well as other materials; to create new products.,,,,5075,,,,,,,,,,,,,,,,,,,,,
10350,FDRS,,Food & Beverage Retailers,G:\FOODDRUG\,1000,,Normal,False,3,1,,PWFOORSM61A,Food;retailers;consumer;goods;convenience;stores;drug;drugs;grocery;groceries;shops;supermarkets,,Food & Beverage Retailers,Food & Beverage Retail Industry,,Food,Reta,,,,,,,,,,27/07/2017 15:06:20,,Companies involved in food and beverage retailing,,hypermarket; supermarket; convenience; stores; tesco; asda; sainsbury; food retail; food store;,10374,,,10345,10375,5464,10305,10427,10348,14301,10233,9955,,,,,,,,,,,,,
4169,FO41W,,Food Additives,G:\FOADGLOB\,1000,,Normal,False,3,1,,PWFOOGMM30C,food;additives;flavours;spice;seasoning;preservatives,,Food Additive Companies,Food Additives Industry,,Food,Chem,,,,,,,,,,02/08/2017 13:21:10,,Companies involved in the design and manufacture of food additives (excludes animals),,stabilizers; thickeners; food agents; emulsifiers,,,,10345,10527,,,,,,,,,,,,,,,,,,,,
23802,FO41E,,Food Additives,G:\FO41E\,1000,0,Normal,False,3,2,,PWFOOGMM71A,,,,,,Food,Food,,,,,,,,,,17/05/2022 00:00:00,,,,,,,,,,,,,,,,,,,,,,,,,,,,,
10346,FOPE,,Food and Beverage Equipment Manufacturers,G:\FOPRODEU\,1000,,Normal,False,3,2,,PWFOOEQM31B,food;food;production;machinery;manufacturers;electrical;machine;machines;produce;autoclave;,,Food Production Machinery Manufacturers,Food Production Machinery Manufacturers,,Food,Mach,,FOPM;FDMN,,,,,,,,05/01/2016 00:00:00,,,,,,,,10347,10345,5080,17980,14531,,,,,,,,,,,,,,,,,
10347,FOPM,,Food and Beverage Equipment Manufacturers,G:\FOPRODMA\,1000,,Normal,False,3,1,,PWFOOEQM31A,food;food;production;machinery;manufacturers;electrical;machine;machines;produce;autoclave;,,Food Production Machinery Manufacturers,Food Production Machinery Manufacturing Industry,,Food,Mach,,FOPE;FDMN,,,,,,,,18/08/2015 00:00:00,,Companies involved in the manufacturing of machinery and equipment for food and beverage processing,,Brine mixing; chopping; slicing; mincing; macerating; liquefaction; fermentation; emulsification; boiling; frying; streaming; grilling; deep frying; baking; mixing; air entrainment; gasification; proofing; pasteurisation; refrigeration; chilling; weighing; x-ray equipment; bakery equipment; bread slicers; depositors; dividers; dough brakes; doughnut equipment; fondant equipment; glazing machines; hot plates; mixers; moulders; oven band lubricating machines; oven loaders/unloaders; ovens; pastry equipment;,,,,10346,10345,656,4849,10489,17980,14531,,,,,,,,,,,,,,,
11635,FBPK,,Food and Beverage Packaging Machinery Manufacturers,G:\FBPACKGL\,1000,,Normal,False,3,1,,PWPRIPPM17A,,,Food and Beverage Packaging Machinery Manufacturers,Food and Beverage Packaging Machinery Manufacturers,,Food,Pack,,,,,,,,,,18/08/2015 00:00:00,,Companies involved in the manufacturing of packaging machinery for the food and beverage industry,,Packaging machinery includes packing; filling; labelling; case erector; case packer; sealing; strapping; palletising; wrapping machine; belt conveyor; clip close,,,,21949,,,,,,,,,,,,,,,,,,,,,
29758,FODA,,Food Ingredients,G:\INGAFOAD\,1000,0,Normal,True,3,2,,PWFOOGMM80A,,,Food Ingredients Companies,Food Ingredients Industry,,Food,Chem,,,,,,,,,,13/05/2025 00:00:00,,,,,,,,,,,,,,,,,,,,,,,,,,,,,
10345,FDMN,,Food Manufacturers,G:\FOODMANU\,1000,,Normal,False,3,1,,PWFOOGMM32A,Food;food;foods;agri;agribusiness;agriculture;dairy;frozen;food;confectionary;tinned;food;fruit;vegetable;milk,,Food Manufacturers,Food Manufacturing Industry,,Food,Mana,,CFOO;FOPM,,,,,,,,08/09/2015 00:00:00,,Companies involved in the manufacturing of fresh; ambient and frozen food products for human consumption,,Food manufacture is the process by which food is manufactured. Food includes grain and seed products; vegetable and animal fats; sugar and confectionery products; fruit and vegetable products; dairy products; animal slaughtering and meat processing; packed meats; seafood product and preparation; bakeries; snack and convenience foods.,10350,4155,,10298,10347,16537,10371,16528,14299,10249,14307,5311,,,,,,,,,,,,,
10802,FOO7E,,Food Manufacturers,G:\FOODMEUR\,1000,,Normal,False,3,2,,PWFOOGMM32E,Food;food;foods;agri;agribusiness;agriculture;dairy;frozen;food;confectionary;tinned;food;fruit;vegetable;milk,,Food Manufacturers,Food Manufacturing Industry,,Food,Mana,,CFOO;FOPM,,,,,,,,08/09/2015 00:00:00,,Companies involved in the manufacturing of fresh; ambient and frozen food products for human consumption,,Food manufacture is the process by which food is manufactured. Food includes grain and seed products; vegetable and animal fats; sugar and confectionery products; fruit and vegetable products; dairy products; animal slaughtering and meat processing; packed meats; seafood product and preparation; bakeries; snack and convenience foods.,,,,10298,10347,,,,,,,,,,,,,,,,,,,,
11603,FLAB,,Food Research Laboratories,G:\FOODLABS\,1000,,Normal,False,3,1,,PWCHESUM27A,,,Food Research Laboratories,Food Research Laboratories,,Food,Heal,,,,,,,,,,15/07/2015 00:00:00,,Companies involved in the provision of technical nutritional testing and analysis in the food industry including animal feed,,Food research laboratories provide a wide range of microbiological testing; chemical analysis; inspection; product testing and certification services (advisory; auditing; certification; consulting; evaluation; inspection; outsourcing; quality assurance; risk management; sustainability; systems certification; testing; training; and validation),,,,10345,4155,16537,,,,,,,,,,,,,,,,,,,
10348,FBWG,,Food Wholesalers & Distributors,G:\FOBEWHOG\,1000,,Normal,False,3,1,,PWFOORSM34A,Food;retailers;consumer;goods;convenience;stores;drug;drugs;grocery;groceries;shops;supermarkets;wholesale;supply;chain;logistic;beverage;drinks,,Food & Beverage Wholesalers,Food & Beverage Wholesalers Industry,,Food,Supp,,,,,,,,,,26/03/2018 00:00:00,,Companies involved in the wholesale grocery distribution market,,excludes food and beverage retailing,10374,,,10345,10349,16,948,14301,10387,10504,10350,10375,9955,,,,,,,,,,,,
10349,FOBE,,Food Wholesalers & Distributors,G:\FOODBEVE\,1000,,Normal,False,3,2,,PWFOORSM34B,Food;retailers;consumer;goods;convenience;stores;drug;drugs;grocery;groceries;shops;supermarkets;wholesale;supply;chain;logistic;beverage;drinks,,Food & Beverage Wholesalers,Food & Beverage Wholesalers Industry,,Food,Supp,,,,,,,,,,26/03/2018 00:00:00,,Companies involved in the wholesale grocery distribution market,,excludes food and beverage retailing,,,,10345,10348,9955,5760,,,,,,,,,,,,,,,,,,
16191,LI22E,,Football Clubs,G:\UEFAFOOT\,1000,,Normal,False,3,2,,PWLEICBM19A,football;soccer;fixtures;football club;conference;league;tickets;england;club;services,,Football Clubs,Football Club Industry,,Leis,Spor,,,,,,,,,,03/08/2017 13:56:25,,,,,,,,1040,14819,5451,5086,,,,,,,,,,,,,,,,,,
10351,FOGL,,Footwear Manufacturers,G:\FOOTGLOB\,1000,,Normal,False,3,1,,PWCLOSPM15A,Footwear;shoes;boots;trainers;boot;shoe;footwear;outdoor;footwear;rubber;footwear;sandels;menswear;ladieswear;sportswear;clothes;clothing;childrenswear;childwear;leathergoods;casual;leather;shoes;hiking;boots;walking;boots;outside;footwear;outward;bound;footwear,,Footwear Manufacturing Companies,Footwear Manufacturing Industry,,Clot,Mana,,FOEU;CL16W,,,,,,,,09/02/2016 00:00:00,,companies involved in the design and manufacture of all types of adult and children's footwear and components,,Footwear refers to garments worn on the feet; for fashion and protection against the environment,10529,,,10352,4179,10278,10276,4126,298,295,315,5087,5089,14075,14076,6068,9482,9481,9957,10150,13706,5088,14317,,
